{
  "schemaVersion": "1.0",
  "id": "l-shaped-floor",
  "name": "L-Shaped Corporate Floor",
  "description": "Non-rectangular floor plate with two cores and daylight on two arms. Use this to prove the packer handles concave boundaries.",
  "units": "meters",
  "floor": {
    "boundary": [[0, 0], [30, 0], [30, 12], [16, 12], [16, 20], [0, 20]],
    "ceilingHeight": 3.4
  },
  "obstacles": [
    {
      "id": "core-1",
      "type": "core",
      "label": "Main lift core",
      "polygon": [[12.5, 0], [16.5, 0], [16.5, 4.5], [12.5, 4.5]],
      "height": 3.4
    },
    {
      "id": "core-2",
      "type": "core",
      "label": "Secondary stair & shaft",
      "polygon": [[0, 16.5], [4.0, 16.5], [4.0, 20], [0, 20]],
      "height": 3.4
    },
    { "id": "col-1", "type": "column", "polygon": [[8, 6], [8.5, 6], [8.5, 6.5], [8, 6.5]], "height": 3.4 },
    { "id": "col-2", "type": "column", "polygon": [[22, 6], [22.5, 6], [22.5, 6.5], [22, 6.5]], "height": 3.4 },
    { "id": "col-3", "type": "column", "polygon": [[8, 14], [8.5, 14], [8.5, 14.5], [8, 14.5]], "height": 3.4 }
  ],
  "openings": [
    { "id": "door-main", "type": "door", "wall": [[17.5, 0], [19.0, 0]], "height": 2.2, "isEntry": true },
    { "id": "door-fire", "type": "door", "wall": [[0, 8.0], [0, 9.2]], "height": 2.1, "isEntry": false },
    { "id": "win-s1", "type": "window", "wall": [[2.0, 0], [11.0, 0]], "height": 1.8, "sillHeight": 0.8 },
    { "id": "win-e1", "type": "window", "wall": [[30, 2.0], [30, 10.0]], "height": 1.8, "sillHeight": 0.8 },
    { "id": "win-n1", "type": "window", "wall": [[5.0, 20], [14.0, 20]], "height": 1.8, "sillHeight": 0.8 },
    { "id": "win-w1", "type": "window", "wall": [[0, 2.0], [0, 7.0]], "height": 1.8, "sillHeight": 0.8 },
    { "id": "win-n2", "type": "window", "wall": [[18.0, 12], [28.0, 12]], "height": 1.8, "sillHeight": 0.8 }
  ],
  "circulation": {
    "mainCorridorWidth": 1.8,
    "secondaryCorridorWidth": 1.2,
    "minClearanceToWall": 0.6
  },
  "metadata": {
    "floorAreaSqM": 488,
    "obstacleAreaSqM": 32.75,
    "notes": "South-east arm is 30x12, north-west arm is 16x8. Best daylight on the east and north edges."
  }
}
