{
  "schemaVersion": "1.0",
  "id": "small-office",
  "name": "Small Office Floor",
  "description": "Simple rectangular bare-shell floor, single entry, one service core. Easiest case - use this to verify the pipeline end to end.",
  "units": "meters",
  "floor": {
    "boundary": [[0, 0], [18, 0], [18, 12], [0, 12]],
    "ceilingHeight": 3.2
  },
  "obstacles": [
    {
      "id": "core-1",
      "type": "core",
      "label": "Lift lobby & services",
      "polygon": [[14.5, 0], [18, 0], [18, 4.5], [14.5, 4.5]],
      "height": 3.2
    }
  ],
  "openings": [
    { "id": "door-main", "type": "door", "wall": [[8.0, 0], [9.2, 0]], "height": 2.1, "isEntry": true },
    { "id": "door-fire", "type": "door", "wall": [[0, 9.0], [0, 10.2]], "height": 2.1, "isEntry": false },
    { "id": "win-n1", "type": "window", "wall": [[2.0, 12], [8.0, 12]], "height": 1.6, "sillHeight": 0.9 },
    { "id": "win-n2", "type": "window", "wall": [[10.0, 12], [16.0, 12]], "height": 1.6, "sillHeight": 0.9 },
    { "id": "win-w1", "type": "window", "wall": [[0, 2.0], [0, 7.0]], "height": 1.6, "sillHeight": 0.9 }
  ],
  "circulation": {
    "mainCorridorWidth": 1.5,
    "secondaryCorridorWidth": 1.2,
    "minClearanceToWall": 0.6
  },
  "metadata": {
    "floorAreaSqM": 216,
    "obstacleAreaSqM": 15.75,
    "notes": "Windows on north and west. Core occupies the south-east corner."
  }
}
